Study Level,Region,Nation,Publication Year,Author,Title,Publication Title,Url,Study Area
Macro Study,General,N/A,2022,"Li, Zhihui; Wu, Jia; Cui, Xiaolin; Mi, Zhaojuan; Peng, Lu",Assessment and influencing factors analysis of economic system vulnerability of the Belt and Road Initiative countries,PLOS ONE,https://doi.org/10.1371/journal.pone.0262611,Multidisciplinary
Macro Study,General,N/A,2021,"Liang, Panning; Yu, Mingyang; Jiang, Lincheng",Energy Investment Risk Assessment for Nations along China’s Belt & Road Initiative: A Deep Learning Method,Applied Sciences,https://www.mdpi.com/2076-3417/11/5/2406,Computer Science
Macro Study,General,N/A,2018,"Liao, Hao; Huang, Xiao-Min; Vidmer, Alexandre; Zhang, Yi-Cheng; Zhou, Ming-Yang",Economic Complexity Based Recommendation Enhance the Efficiency of the Belt and Road Initiative,Entropy,http://www.mdpi.com/1099-4300/20/9/718,Mathematics
Macro Study,General,N/A,2020,"Liao, Hongwei; Chi, Yedi; Zhang, Jiarui",Impact of international development aid on FDI along the Belt and Road,China Economic Review,https://linkinghub.elsevier.com/retrieve/pii/S1043951X20300456,"Economics, Econometrics and Finance"
Macro Study,General,N/A,2019,"Liao, Zhewen; Wang, Zhongxing; Guo, Kun",The dynamic evolution of the characteristics of exchange rate risks in countries along “The Belt and Road” based on network analysis,PLOS ONE,https://dx.plos.org/10.1371/journal.pone.0221874,Multidisciplinary
Macro Study,General,N/A,2022,"Liaqat, Idrees; Gao, Yongqiang; Rehman, Faheem Ur; Lakner, Zoltán; Oláh, Judit",National Culture and Financial Inclusion: Evidence from Belt and Road Economies,Sustainability,https://doi.org/10.3390/su14063405,Development
Macro Study,General,N/A,2021,"Lin, Boqiang; Bega, François",China's Belt & Road Initiative Coal Power Cooperation: Transitioning Toward Low-Carbon Development,Energy Policy,https://linkinghub.elsevier.com/retrieve/pii/S0301421521003086,(2) Energy / Environmental Science
Macro Study,General,N/A,2017,"Lin, Kuo-Ping; Hung, Kuo-Chen; Lin, Yu-Ting; Hsieh, Yao-Hung",Green Suppliers Performance Evaluation in Belt and Road Using Fuzzy Weighted Average with Social Media Information,Sustainability,http://www.mdpi.com/2071-1050/10/1/5,(2) Environmental Science / Development
Macro Study,General,N/A,2020,"Lin, Ping; Lin, Boqiang; Lin, Mengting; Lin, Chen",Empirical Study of Factors Influencing Performance of Chinese Enterprises in Overseas Mergers and Acquisitions in Context of Belt and Road Initiative—A Perspective Based on Political Connections,Emerging Markets Finance and Trade,https://www.tandfonline.com/doi/full/10.1080/1540496X.2019.1676226,"Economics, Econometrics and Finance"
Macro Study,General,N/A,2021,"Lin, Shaun; Shimazu, Naoko; Sidaway, James D.",Theorising from the Belt and Road Initiative (一带一路),Asia Pacific Viewpoint,https://onlinelibrary.wiley.com/doi/10.1111/apv.12322,Development
Macro Study,General,N/A,2019,"Lin, Weiqiang","Transport geography and geopolitics: Visions, rules and militarism in China's Belt and Road Initiative and beyond",Journal of Transport Geography,https://linkinghub.elsevier.com/retrieve/pii/S0966692319303783,(2) Development / Transportation
Macro Study,General,N/A,2023,"Lin, Xiaojie; Sun, Peng; Zhong, Wei; Wang, Jian",Thermodynamic analysis and operation investigation of a cross-border integrated energy system based on steam Carnot battery,Applied Thermal Engineering,https://linkinghub.elsevier.com/retrieve/pii/S1359431122017343,Energy
Macro Study,General,N/A,2021,"Lindberg, Jonas; Biddulph, Robin",China’s Belt And Road Initiative: The Need For Livelihood-Inclusive Stories,Geoforum,https://linkinghub.elsevier.com/retrieve/pii/S0016718521000592,Sociology and Political Science
Macro Study,General,N/A,2020,"Liu, Ailan; Lu, Cuicui; Wang, Zhixuan",The roles of cultural and institutional distance in international trade: Evidence from China's trade with the Belt and Road countries,China Economic Review,https://linkinghub.elsevier.com/retrieve/pii/S1043951X1830138X,"Economics, Econometrics and Finance"
Macro Study,General,N/A,2018,"Liu, Chonghao; Liu, Qunyi; Li, Jianwu; Li, Ying; Wang, Anjian",China’s Belt and Road Initiative in Support of the Resourcing Future Generations Program,Natural Resources Research,http://link.springer.com/10.1007/s11053-017-9342-7,Environmental Science
Macro Study,General,Indonesia / Pakistan,2022,"Liu, Chuyu; Hale, Thomas; Urpelainen, Johannes",Explaining the energy mix in China’s electricity projects under the belt and road initiative,Environmental Politics,https://doi.org/10.1080/09644016.2022.2087355,Environmental Science
Macro Study,General,N/A,2022,"Liu, Fang; Khan, Yasir; Marie, Mohamed",Carbon neutrality challenges in Belt and Road countries: what factors can contribute to CO2 emissions mitigation?,Environmental Science and Pollution Research,https://link.springer.com/10.1007/s11356-022-22983-0,Environmental Science
Macro Study,General,N/A,2021,"Liu, Gengyuan; Nawab, Asim; Meng, Fanxin; Shah, Aamir Mehmood; Deng, Xiaoya; Hao, Yan; Giannetti, Biagio F.; Agostinho, Feni; Almeida, Cecília M. V. B.; Casazza, Marco",Understanding the Sustainability of the Energy–Water–Land Flow Nexus in Transnational Trade of the Belt and Road Countries,Energies,https://www.mdpi.com/1996-1073/14/19/6311,Energy
Macro Study,General,N/A,2018,"Liu, Haimeng; Fang, Chuanglin; Miao, Yi; Ma, Haitao; Zhang, Qiang; Zhou, Qiang",Spatio-temporal evolution of population and urbanization in the countries along the Belt and Road 1950–2050,Journal of Geographical Sciences,http://link.springer.com/10.1007/s11442-018-1513-x,Earth and Planetary Sciences
Macro Study,General,N/A,2018,"Liu, Haiyue; Jiang, Jie; Zhang, Lei; Chen, Xiaolan",OFDI Agglomeration and Chinese Firm Location Decisions under the “Belt and Road” Initiative,Sustainability,http://www.mdpi.com/2071-1050/10/11/4060,Development
Macro Study,General,N/A,2020,"Liu, Haiyue; Wang, Yile; Jiang, Jie; Wu, Peng",How green is the “Belt and Road Initiative”? – Evidence from Chinese OFDI in the energy sector,Energy Policy,https://linkinghub.elsevier.com/retrieve/pii/S0301421520304365,(2) Energy / Environmental Science
Macro Study,General,N/A,2022,"Liu, Hong",China engages the Global South: From Bandung to the Belt and Road Initiative,Global Policy,https://doi.org/10.1111/1758-5899.13034,"(2) Economics, Econometrics and Finance / Political Science and International Relations"
Macro Study,General,N/A,2022,"Liu, Kai; Miao, Wen; Jia, Haoyi",How political risk in host country affects FDI: an explanation for the paradox of China’s investment risk preference,Transnational Corporations Review,https://www.tandfonline.com/doi/full/10.1080/19186444.2022.2151792,"(2) Business, Management and Accounting / Development"
Macro Study,General,N/A,2020,"Liu, Min; Su, Cong; Wang, Fangfang; Huang, Liangxiong",Chinese Cross-Border M&As In The “One Belt One Road” Countries: The Impact Of Confucius Institutes,China Economic Review,https://linkinghub.elsevier.com/retrieve/pii/S1043951X20300298,"Economics, Econometrics and Finance"
Macro Study,General,N/A,2019,"Liu, Qionghuan; Wang, Xiuhong; Zhang, Yili; Zhang, Huamin; Li, Lanhui",Vegetation Degradation and Its Driving Factors in the Farming–Pastoral Ecotone over the Countries along Belt and Road Initiative,Sustainability,https://www.mdpi.com/2071-1050/11/6/1590,(2) Environmental Science / Development
Macro Study,General,N/A,2020,"Liu, Wei; Hughes, Alice C.; Sachdeva, Gulshan; Narain, Divya; Zhou, Taidong; Wang, Yao; Gallagher, Kevin; Turschwell, Mischa; Tian, Xu; Han, Mengyao",The Belt and Road Initiative and the Sustainable Development Goals,One Earth,https://linkinghub.elsevier.com/retrieve/pii/S2590332220304292,(2) Earth and Planetary Sciences / Environmental Science
Macro Study,General,N/A,2016,"Liu, Weidong; Dunford, Michael",Inclusive globalization: unpacking China's Belt and Road Initiative,Area Development and Policy,https://www.tandfonline.com/doi/full/10.1080/23792949.2016.1232598,(2) Development / Sociology and Political Science
Macro Study,General,N/A,2021,"Liu, Weidong; Yao, Qiuhui",Theorizing Belt and Road construction mode from institutional and cultural perspectives,Journal of Geographical Sciences,https://link.springer.com/10.1007/s11442-021-1862-8,Earth and Planetary Sciences
Macro Study,General,N/A,2020,"Liu, Weidong; Zhang, Yajing; Xiong, Wei",Financing the Belt and Road Initiative,Eurasian Geography and Economics,https://www.tandfonline.com/doi/full/10.1080/15387216.2020.1716822,Development
Macro Study,General,N/A,2022,"Liu, Xiaofeng; Bennett, Mia M.",The geopolitics of knowledge communities: Situating Chinese and foreign studies of the Green Belt and Road Initiative,Geoforum,https://doi.org/10.1016/j.geoforum.2021.12.014,Sociology and Political Science
Macro Study,General,N/A,2019,"Liu, Xuan; Blackburn, Tim M.; Song, Tianjian; Li, Xianping; Huang, Cong; Li, Yiming",Risks of Biological Invasion on the Belt and Road,Current Biology,https://linkinghub.elsevier.com/retrieve/pii/S0960982218316701,Agricultural and Biological Sciences
Macro Study,General,N/A,2019,"Liu, Yanxu; Zhao, Wenwu; Hua, Ting; Wang, Shuai; Fu, Bojie",Slower vegetation greening faced faster social development on the landscape of the Belt and Road region,Science of The Total Environment,https://linkinghub.elsevier.com/retrieve/pii/S004896971934080X,Environmental Science
Macro Study,General,N/A,2022,"Liu, Yazhen; Wang, Rong",Research on the Environmental Effects of China’s Outward Foreign Direct Investment (OFDI): Empirical Evidence Based on the Implementation of the “Belt and Road” Initiative (BRI),Sustainability,https://www.mdpi.com/2071-1050/14/19/12868,(2) Environmental Science / Development
Macro Study,General,N/A,2018,"Liu, Yunyang; Hao, Yu","The dynamic links between CO2 emissions, energy consumption and economic development in the countries along “the Belt and Road”",Science of The Total Environment,https://linkinghub.elsevier.com/retrieve/pii/S0048969718325452,Environmental Science
Macro Study,General,N/A,2020,"Liu, Zhao; Zhang, Huan; Zhang, Yue-Jun; Qin, Chang-Xiong",How does income inequality affect energy efficiency? Empirical evidence from 33 Belt and Road Initiative countries,Journal of Cleaner Production,https://linkinghub.elsevier.com/retrieve/pii/S0959652620324689,Energy
Macro Study,General,Pakistan / Malaysia,2020,"Liu, Zhigao; Schindler, Seth; Liu, Weidong","Demystifying Chinese overseas investment in infrastructure: Port development, the Belt and Road Initiative and regional development",Journal of Transport Geography,https://linkinghub.elsevier.com/retrieve/pii/S0966692319307112,Development
Macro Study,General,N/A,2019,"Liu, Zuankuo; Xin, Li",Has China's Belt And Road Initiative Promoted Its Green Total Factor Productivity？——Evidence From Primary Provinces Along The Route,Energy Policy,https://linkinghub.elsevier.com/retrieve/pii/S0301421519301284,(2) Energy / Environmental Science
Macro Study,General,N/A,2021,"Lorenzo, Johanna Aleria P",A Path Toward Sustainable Development Along the Belt and Road,Journal of International Economic Law,https://academic.oup.com/jiel/article/24/3/591/6375184,Law
Macro Study,General,N/A,2020,"Lu, Qinli; Fang, Kai; Heijungs, Reinout; Feng, Kuishuang; Li, Jiashuo; Wen, Qi; Li, Yanmei; Huang, Xianjin",Imbalance and drivers of carbon emissions embodied in trade along the Belt and Road Initiative,Applied Energy,https://linkinghub.elsevier.com/retrieve/pii/S0306261920313933,Environmental Science
Macro Study,General,N/A,2021,"Lu, Yue; Gu, Wei; Zeng, Ka",Does the Belt and Road Initiative Promote Bilateral Political Relations?,China & World Economy,https://onlinelibrary-wiley-com.proxy01.its.virginia.edu/doi/pdf/10.1111/cwe.12387,"Economics, Econometrics and Finance"
Macro Study,General,N/A,2021,"Luo, Zhi; Wan, Guanghua; Wang, Chen; Zhang, Xun",The distributive impacts of the Belt and Road Initiative,Journal of Economic Surveys,https://doi.org/10.1111/joes.12436,"Economics, Econometrics and Finance"
Macro Study,General,N/A,2022,"Ma, Shengnan",Growth effects of economic integration: New evidence from the Belt and Road Initiative,Economic Analysis and Policy,https://doi.org/10.1016/j.eap.2022.01.004,"Economics, Econometrics and Finance"
Macro Study,General,N/A,2021,"Mao, Xiangyu; Wang, Ying",Cooperative carbon emission reduction through the Belt and Road Initiative,Environmental Science and Pollution Research,https://link.springer.com/article/10.1007/s11356-021-16130-4,Environmental Science
Macro Study,General,N/A,2019,"Mekhdiev, Elnur; Pashkovskaya, Irina; Takmakova, Elena; Smirnova, Olga; Sadykova, Khadiya; Poltorykhina, Svetlana",Conjugation of the Belt and Road Initiative and Eurasian Economic Union: Problems and Development Prospects,Economies,https://www.mdpi.com/2227-7099/7/4/118,"(2) Economics, Econometrics and Finance / Development"
Macro Study,General,N/A,2022,"Ming, Zhu",The Partnership for Global Infrastructure and Investment: An Alternative for China's Belt and Road Initiative?,China Quarterly of International Strategic Studies,https://www.worldscientific.com/doi/10.1142/S2377740022500087,Sociology and Political Science
Macro Study,General,N/A,2021,"Mitchell, David",Making Or Breaking Regions: China’s Belt Road Initiative And The Meaning For Regional Dynamics,Geopolitics,https://www.tandfonline.com/doi/full/10.1080/14650045.2020.1716738,(2) Development / Political Science and International Relations
Macro Study,General,Ghana / Cambodia,2019,"Mohan, Giles; Tan-Mullins, May",The Geopolitics Of South–South Infrastructure Development: Chinese-Financed Energy Projects In The Global South,Urban Studies,http://journals.sagepub.com/doi/10.1177/0042098018794351,Urban Studies
Macro Study,General,N/A,2021,"Mohsin, A. K. M.; Lei, Hongzhen; Tushar, Hasanuzzaman; Hossain, Syed Far Abid; Hossain, Mohammad Ebrahim; Sume, Afroja Hossain",Cultural and Institutional Distance of China’s Outward Foreign Direct Investment Toward the “Belt and Road” Countries,The Chinese Economy,https://www.tandfonline.com/doi/full/10.1080/10971475.2020.1848468,"Economics, Econometrics and Finance"
Macro Study,General,N/A,2022,"Mohsin, A.K.M.; Tushar, Hasanuzzaman; Abid Hossain, Sayed Far; Shams Chisty, Kazi Khaled; Masum Iqbal, Mohammed; Kamruzzaman, Md.; Rahman, Siddiqur","Green logistics and environment, economic growth in the context of the Belt and Road Initiative",Heliyon,https://doi.org/10.1016/j.heliyon.2022.e09641,Multidisciplinary
Macro Study,General,N/A,2020,"Mou, Naixia; Fang, Yujie; Yang, Tengfei; Zhang, Lingxian",Assortative Analysis of Bulk Trade Complex Network on Maritime Silk Road,IEEE Access,https://ieeexplore.ieee.org/document/9143120/,Computer Science
Macro Study,General,N/A,2018,"Mou, Naixia; Liu, Caixia; Zhang, Lingxian; Fu, Xin; Xie, Yichun; Li, Yong; Peng, Peng",Spatial Pattern and Regional Relevance Analysis of the Maritime Silk Road Shipping Network,Sustainability,http://www.mdpi.com/2071-1050/10/4/977,Development
Macro Study,General,N/A,2021,"Mou, Naixia; Ren, Haonan; Zheng, Yunhao; Chen, Jinhai; Niu, Jiqiang; Yang, Tengfei; Zhang, Lingxian; Liu, Feng",Traffic Inequality and Relations in Maritime Silk Road: A Network Flow Analysis,ISPRS International Journal of Geo-Information,https://www.mdpi.com/2220-9964/10/1/40,Earth and Planetary Sciences
Macro Study,General,N/A,2020,"Mou, Naixia; Sun, Shuyue; Yang, Tengfei; Wang, Zhipeng; Zheng, Yunhao; Chen, Jinhai; Zhang, Lingxian",Assessment of the Resilience of a Complex Network for Crude Oil Transportation on the Maritime Silk Road,IEEE Access,https://ieeexplore.ieee.org/document/9210575/,Computer Science
Macro Study,General,N/A,2021,"Mou, Naixia; Wang, Chunying; Chen, Jinhai; Yang, Tengfei; Zhang, Lingxian; Liao, Mengdi",Spatial pattern of location advantages of ports along the Maritime Silk Road,Journal of Geographical Sciences,http://link.springer.com/10.1007/s11442-021-1837-9,Earth and Planetary Sciences
Macro Study,General,N/A,2022,"Mou, Naixia; Wang, Chunying; Yang, Tengfei; Ren, Haonan; Zhang, Lingxian; Xu, Huanqing; Liu, Wenbao",Spatiotemporal patterns of maritime trade between China and Maritime Silk Road: Evidence from a quantitative study using social network analysis,Journal of Transport Geography,https://linkinghub.elsevier.com/retrieve/pii/S0966692322001107,Transportation
Macro Study,General,N/A,2019,"Mou, Naixia; Xie, Yanxin; Yang, Tengfei; Zhang, Hengcai; Kim, Yoo Ri",The Impact of Slumping Oil Price on the Situation of Tanker Shipping along the Maritime Silk Road,Sustainability,https://www.mdpi.com/2071-1050/11/17/4796,Development
Macro Study,General,N/A,2021,"Muhammad, Sulaman; Long, Xingle",Rule Of Law And Co2 Emissions: A Comparative Analysis Across 65 Belt And Road Initiative (BRI) Countries,Journal of Cleaner Production,https://linkinghub.elsevier.com/retrieve/pii/S0959652620335848,Environmental Science
Macro Study,General,N/A,2020,"Muhammad, Sulaman; Long, Xingle",China's seaborne oil import and shipping emissions: The prospect of belt and road initiative,Marine Pollution Bulletin,https://linkinghub.elsevier.com/retrieve/pii/S0025326X20305403,(2) Earth and Planetary Sciences / Environmental Science
Macro Study,General,N/A,2020,"Muhammad, Sulaman; Long, Xingle; Salman, Muhammad; Dauda, Lamini",Effect of urbanization and international trade on CO2 emissions across 65 belt and road initiative countries,Energy,https://linkinghub.elsevier.com/retrieve/pii/S0360544220302097,Environmental Science
Macro Study,General,N/A,2022,"Nanli, Zhu; Xiaoping, Li; Sohail Akhtar, Muhammad; Bilal, Ahmer",Clean technology and the environment: Key issues and implications in belt and road initiative economies,Frontiers in Environmental Science,https://www.frontiersin.org/articles/10.3389/fenvs.2022.1009155/full,Environmental Science
Macro Study,General,N/A,2020,"Narain, Divya; Maron, Martine; Teo, Hoong Chen; Hussey, Karen; Lechner, Alex Mark",Best-practice biodiversity safeguards for Belt and Road Initiative’s financiers,Nature Sustainability,http://www.nature.com/articles/s41893-020-0528-3,(2) Agricultural and Biological Sciences / Environmental Science
Macro Study,General,N/A,2022,"Nie, Ying; Liu, Qingjie; Liu, Rong; Ren, Dexiao; Zhong, Yao; Yu, Feng",The Threshold Effect of FDI on CO2 Emission in Belt and Road Countries,Environmental Research and Public Health,https://doi.org/10.3390/ijerph19063523,Environmental Science
Macro Study,General,N/A,2020,"Nitsche, Benjamin",Decrypting the Belt and Road Initiative: Barriers and Development Paths for Global Logistics Networks,Sustainability,https://www.mdpi.com/2071-1050/12/21/9110,Development
Macro Study,General,N/A,2021,"Oakes, Tim","The Belt and Road as method: Geopolitics, technopolitics and power through an infrastructure lens",Asia Pacific Viewpoint,https://onlinelibrary.wiley.com/doi/10.1111/apv.12319,Development
Macro Study,General,N/A,2020,"Oliveira, Gustavo De L.T.; Murton, Galen; Rippa, Alessandro; Harlan, Tyler; Yang, Yang",China’s Belt And Road Initiative: Views From The Ground,Political Geography,https://linkinghub.elsevier.com/retrieve/pii/S0962629820301177,(2) Development / Sociology and Political Science
Macro Study,General,N/A,2022,"Ouyang, Shanshan; Li, Yanxi; Wu, Haowen; Zhao, Heng; Xu, Runxiang",Structure and Evolution of the Greenfield FDI Network Along the Belt and Road,Research in International Business and Finance,https://linkinghub.elsevier.com/retrieve/pii/S0275531922002380,"(2) Business, Management and Accounting / Economics, Econometrics and Finance"
Macro Study,General,N/A,2020,"Pan, Chunyang; Wei, William X.; Muralidharan, Etayankara; Liao, Jia; Andreosso-O’Callaghan, Bernadette",Does China’s Outward Direct Investment Improve the Institutional Quality of the Belt and Road Countries?,Sustainability,https://www.mdpi.com/2071-1050/12/1/415,Development
Macro Study,General,N/A,2021,"Pan, Jingjing; Bell, Michael G. H.; Cheung, Kam-Fung; Perera, Supun",Identifying container shipping network bottlenecks along China’s Maritime Silk Road based on a spectral analysis,Maritime Policy & Management,https://www.tandfonline.com/doi/full/10.1080/03088839.2020.1841312,Transportation
Macro Study,General,N/A,2022,"Pan, Su; Chong, Zhaohui",Effects of FDI on trade among countries along the Belt and Road: A network perspective,The Journal of International Trade & Economic Development,https://doi.org/10.1080/09638199.2022.2078865,Development
Macro Study,General,N/A,2022,"Pan, Wen-Tsao; Jiang, Bingqian; Wang, Yuting; Cai, Yueyuan; Ji, Xiaoxia",Comparison and Suggestions of Logistics Performance Index of Main Countries of Belt and Road Strategy Based on Bootstrap DEA Model,Computational Intelligence and Neuroscience,https://www.hindawi.com/journals/cin/2022/2159578/,Mathematics
Macro Study,General,N/A,2020,"Panibratov, Andrei; Kalinin, Alexey; Zhang, Yugui; Ermolaeva, Liubov; Korovkin, Vladimir; Nefedov, Konstantin; Selivanovskikh, Louisa",The belt and road initiative: a systematic literature review and future research agenda,Eurasian Geography and Economics,https://doi.org/10.1080/15387216.2020.1857288,"(2) Economics, Econometrics and Finance / Development"
Macro Study,General,N/A,2022,"Peng, Benhong; Luo, Rong; Elahi, Ehsan; Wan, Anxia",Co-finance for energy project under the Belt and Road Initiative: an application of evidential reasoning-group decision-making method,Environmental Science and Pollution Research,https://link.springer.com/10.1007/s11356-022-23447-1,Environmental Science
Macro Study,General,N/A,2020,"Peng, Fei; Kang, Lili; Liu, Taoxiong; Cheng, Jia; Ren, Luxiao",Trade Agreements and Global Value Chains: New Evidence from China’s Belt and Road Initiative,Sustainability,https://www.mdpi.com/2071-1050/12/4/1353,Development
Macro Study,General,N/A,2021,"Peng, Hua-Rong; Qi, Shao-Zhou; Zhang, Yue-Jun",Does trade promote energy efficiency convergence in the Belt and Road Initiative countries?,Journal of Cleaner Production,https://linkinghub.elsevier.com/retrieve/pii/S0959652621032522,Energy
Macro Study,General,N/A,2022,"Peng, Hua-Rong; Tan, Xiujie; Managi, Shunsuke; Taghizadeh-Hesary, Farhad",Club convergence in energy efficiency of Belt and Road Initiative countries: The role of China’s outward foreign direct investment,Energy Policy,https://doi.org/10.1016/j.enpol.2022.113139,Energy
Macro Study,General,N/A,2018,"Peng, Peng; Yang, Yu; Lu, Feng; Cheng, Shifen; Mou, Naixia; Yang, Ren",Modelling the competitiveness of the ports along the Maritime Silk Road with big data,Transportation Research Part A: Policy and Practice,https://linkinghub.elsevier.com/retrieve/pii/S0965856418310267,Transportation
Macro Study,General,N/A,2019,"Pomfret, Richard",The Eurasian Land Bridge: linking regional value chains along the New Silk Road,"Cambridge Journal of Regions, Economy and Society",https://academic.oup.com/cjres/article/12/1/45/5292534,"(3) Economics, Econometrics and Finance / Development / Sociology and Political Science"
Macro Study,General,N/A,2019,"Pomfret, Richard","The Eurasian Landbridge and China's Belt and Road Initiative: Demand, supply of services and public policy",The World Economy,https://onlinelibrary.wiley.com/doi/10.1111/twec.12758,"Economics, Econometrics and Finance"
Macro Study,General,N/A,2022,"Qayyum, Muhammad; Yuyuan, Yu; Bhatti, Uzair Aslam; Shijie, Li",Evaluation of the one belt and one road (OBOR) in economic development and suggestions analysis based on SWOT analysis with weighted AHP and entropy methods,Multimedia Tools and Applications,https://link.springer.com/10.1007/s11042-022-13565-w,Computer Science
Macro Study,General,N/A,2019,"Qi, Shao-Zhou; Peng, Hua-Rong; Zhang, Yue-Jun",Energy intensity convergence in Belt and Road Initiative (BRI) countries: What role does China-BRI trade play?,Journal of Cleaner Production,https://linkinghub.elsevier.com/retrieve/pii/S0959652619328926,Energy
Macro Study,General,N/A,2019,"Qi, Shaozhou; Peng, Huarong; Zhang, Xiaoling; Tan, Xiujie",Is energy efficiency of Belt and Road Initiative countries catching up or falling behind? Evidence from a panel quantile regression approach,Applied Energy,https://linkinghub.elsevier.com/retrieve/pii/S0306261919312553,Energy
Macro Study,General,N/A,2022,"Qi, Yingxiu; Harrod, Steven; Psaraftis, Harilaos N.; Lang, Maoxiang",Transport service selection and routing with carbon emissions and inventory costs consideration in the context of the Belt and Road Initiative,Logistics and Transportation Review,https://doi.org/10.1016/j.tre.2022.102630,"(3) Business, Management and Accounting / Decision Sciences / Transportation"
Macro Study,General,N/A,2022,"Qian, Chen; Madni, Ghulam Rasool","Encirclement of Natural Resources, Green Investment, and Economic Complexity for Mitigation of Ecological Footprints in BRI Countries",Sustainability,https://www.mdpi.com/2071-1050/14/22/15269,(2) Environmental Science / Development
Macro Study,General,N/A,2022,"Qian, Xiang-Yan; Liang, Qiao-Mei; Liu, Li-Jing; Zhang, Kun; Liu, Yu","Key points for green management of water-energy-food in the Belt and Road Initiative: Resource utilization efficiency, final demand behaviors and trade inequalities",Journal of Cleaner Production,https://doi.org/10.1016/j.jclepro.2022.132386,(2) Energy / Environmental Science
Macro Study,General,N/A,2021,"Qian, Xiaoyan; Bai, Yang; Huang, Weilun; Dai, Jie; Li, Xuan; Wang, Yuanzhu",Fuzzy Technique Application in Selecting Photovoltaic Energy and Solar Thermal Energy Production in Belt and Road Countries,Journal of Energy Storage,https://linkinghub.elsevier.com/retrieve/pii/S2352152X21005879,Energy
Macro Study,General,N/A,2022,"Qian, Xinbei; Huang, Liangxiong; Wang, Xianbin; Wang, Shuqi",Detecting pivotal countries of China's OFDI in the “Belt and Road” initiative: The perspective of similarity of doing business,International Review of Economics & Finance,https://doi.org/10.1016/j.iref.2021.10.007,"Economics, Econometrics and Finance"
