Study Level,Region,Nation,Publication Year,Author,Title,Publication Title,Url,Study Area
National Study,Europe & North America,Russia,2020,"Gao, Sheng",Sports Trans-Cultural Communication between China and Russia under the Belt and Road Initiative,The International Journal of the History of Sport,https://www.tandfonline.com/doi/full/10.1080/09523367.2020.1757654,Social Sciences (Misc.)
Regional Study,Europe & North America,N/A,2019,"Ma, Degong; Lei, Chun; Ullah, Farid; Ullah, Raza; Baloch, Qadar Bakhsh",China’s One Belt and One Road Initiative and Outward Chinese Foreign Direct Investment in Europe,Sustainability,https://www.mdpi.com/2071-1050/11/24/7055,Development
Regional Study,Europe & North America,N/A,2021,"Miao, Julie T.",Understanding the soft power of China’s Belt and Road Initiative through a discourse analysis in Europe,"Regional Studies, Regional Science",https://www.tandfonline.com/doi/full/10.1080/21681376.2021.1921612,Sociology and Political Science
Regional Study,Europe & North America,N/A,2020,"Zhao, Laijun; Stoeter, Johan; Li, Huiyong; Hu, Qingmi; Cheng, Zhaolin; Wang, Xiaoli",European hub location problem for China Railway Express in the context of the Belt and Road Initiative,International Journal of Logistics Research and Applications,https://www.tandfonline.com/doi/full/10.1080/13675567.2020.1777955,"(2) Business, Management and Accounting / Decision Sciences"
Macro Study,General,N/A,2021,"Abban, Olivier Joseph; Hongxing, Yao",What initiates carbon dioxide emissions along the Belt and Road Initiative? An insight from a dynamic heterogeneous panel data analysis based on incarnated carbon panel,Environmental Science and Pollution Research,https://link.springer.com/10.1007/s11356-021-14779-5,Environmental Science
Macro Study,General,N/A,2020,"Abban, Olivier Joseph; Wu, Jiying; Mensah, Isaac Adjei","Analysis on the nexus amid CO2 emissions, energy intensity, economic growth, and foreign direct investment in Belt and Road economies: does the level of income matter?",Environmental Science and Pollution Research,http://link.springer.com/10.1007/s11356-020-07685-9,Environmental Science
Macro Study,General,N/A,2022,"Abbas, Hasnain; Zhao, Lindu; Faiz, Narmeen; Ullah, Hafeez; Gong, Jianxia; Jiang, Weiying",One belt one road influence on perishable food supply chain robustness,"Environment, Development and Sustainability",https://link.springer.com/10.1007/s10668-021-01833-y,"(2) Economics, Econometrics and Finance / Development"
Macro Study,General,N/A,2020,"Abbas, Qaiser; Nurunnabi, Mohammad; Alfakhri, Yazeed; Khan, Waqar; Hussain, Altaf; Iqbal, Wasim","The role of fixed capital formation, renewable and non-renewable energy in economic growth and carbon emission: a case study of Belt and Road Initiative project",Environmental Science and Pollution Research,https://link.springer.com/10.1007/s11356-020-10413-y,Environmental Science
Macro Study,General,N/A,2021,"Abdulsalam, Alnoah; Xu, Helian; Ameer, Waqar; Abdo, AL-Barakani; Xia, Jiejin",Exploration of the Impact of China’s Outward Foreign Direct Investment (FDI) on Economic Growth in Asia and North Africa along the Belt and Road (B&R) Initiative,Sustainability,https://www.mdpi.com/2071-1050/13/4/1623,Development
Macro Study,General,N/A,2020,"Ahmad, Mahmood; Jiang, Ping; Majeed, Abdul; Raza, Muhammad Yousaf",Does financial development and foreign direct investment improve environmental quality? Evidence from belt and road countries,Environmental Science and Pollution Research,https://link.springer.com/10.1007/s11356-020-08748-7,Environmental Science
Macro Study,General,N/A,2019,"Aibai, Abuduwali; Huang, Xianjing; Luo, Yu; Peng, Yuchao","Foreign Direct Investment, Institutional Quality, and Financial Development along the Belt and Road: An Empirical Investigation",Emerging Markets Finance and Trade,https://www.tandfonline.com/doi/full/10.1080/1540496X.2018.1559139,"Economics, Econometrics and Finance"
Macro Study,General,N/A,2021,"Akbar, Muhammad Waqas; Yuelan, Peng; Maqbool, Adnan; Zia, Zeenat; Saeed, Muhammad",The nexus of sectoral-based CO2 emissions and fiscal policy instruments in the light of Belt and Road Initiative,Environmental Science and Pollution Research,https://link.springer.com/10.1007/s11356-021-13040-3,Environmental Science
Macro Study,General,N/A,2022,"AL-Barakani, Abdo; Bin, Li; Zhang, Xiaodong; Saeed, Mushref; Qahtan, Anwar Saeed Ahmed; Hamood Ghallab, Hamdan Mutahar",Spatial analysis of financial development's effect on the ecological footprint of belt and road initiative countries: Mitigation options through renewable energy consumption and institutional quality,Journal of Cleaner Production,https://linkinghub.elsevier.com/retrieve/pii/S0959652622022946,(2) Energy / Environmental Science
Macro Study,General,N/A,2021,"An, Hui; Razzaq, Asif; Haseeb, Muhammad; Mihardjo, Leonardus W. W.",The role of technology innovation and people’s connectivity in testing environmental Kuznets curve and pollution heaven hypotheses across the Belt and Road host countries: new evidence from Method of Moments Quantile Regression,Environmental Science and Pollution Research,https://link.springer.com/10.1007/s11356-020-10775-3,Environmental Science
Macro Study,General,N/A,2021,"An, Hui; Razzaq, Asif; Nawaz, Ahsan; Noman, Sohail M.; Khan, Syed Abdul Rehman",Nexus between green logistic operations and triple bottom line: evidence from infrastructure-led Chinese outward foreign direct investment in Belt and Road host countries,Environmental Science and Pollution Research,https://link.springer.com/10.1007/s11356-021-12470-3,Environmental Science
Macro Study,General,N/A,2019,"Andrić, Jelena M.; Wang, Jiayuan; Zhong, Ruoyu",Identifying the Critical Risks in Railway Projects Based on Fuzzy and Sensitivity Analysis: A Case Study of Belt and Road Projects,Sustainability,https://www.mdpi.com/2071-1050/11/5/1302,Development
Macro Study,General,N/A,2019,"Andrić, Jelena M.; Wang, Jiayuan; Zou, Patrick X. W.; Zhang, Jingrong; Zhong, Ruoyu",Fuzzy Logic–Based Method For Risk Assessment Of Belt And Road Infrastructure Projects,Journal of Construction Engineering and Management,http://ascelibrary.org/doi/10.1061/%28ASCE%29CO.1943-7862.0001721,"Business, Management and Accounting"
Macro Study,General,N/A,2020,"Anwar, Awais; Ahmad, Nawaz; Madni, Ghulam Rasool","Industrialization, Freight Transport and Environmental Quality: Evidence from Belt and Road Initiative Economies",Environmental Science and Pollution Research,http://link.springer.com/10.1007/s11356-019-07255-8,Environmental Science
Macro Study,General,N/A,2021,"Anwar, Muhammad Awais; Nasreen, Samia; Tiwari, Aviral Kumar","Forestation, renewable energy and environmental quality: Empirical evidence from Belt and Road Initiative economies",Journal of Environmental Management,https://linkinghub.elsevier.com/retrieve/pii/S0301479721007465,Environmental Science
Macro Study,General,Indonesia / Kazakhstan / Cambodia,2022,"Apirakvanalee, Laksup; Zhai, Yida",Telling stories from the New Silk Road: A news discourse analysis of BBC’s podcast episodes on the Belt and Road Initiative,Journalism,https://doi.org/10.1177/14648849221107223,Communication
Macro Study,General,Greece / Sri Lanka / United Kingdom,2021,"Apostolopoulou, Elia","Tracing the Links between Infrastructure‐Led Development, Urban Transformation, and Inequality in China’s Belt and Road Initiative",Antipode,https://onlinelibrary.wiley.com/doi/10.1111/anti.12699,Development
Macro Study,General,N/A,2018,"Ascensão, Fernando; Fahrig, Lenore; Clevenger, Anthony P.; Corlett, Richard T.; Jaeger, Jochen A. G.; Laurance, William F.; Pereira, Henrique M.",Environmental Challenges For The Belt And Road Initiative,Nature Sustainability,http://www.nature.com/articles/s41893-018-0059-3,Environmental Science
Macro Study,General,N/A,2022,"Ashraf, Junaid","The spillover effects of political risk, financial risk, and economic freedom on ecological footprint: Empirical evidence from Belt and Road Initiative countries",Borsa Istanbul Review,https://doi.org/10.1016/j.bir.2022.06.004,"Economics, Econometrics and Finance"
Macro Study,General,N/A,2022,"Ashraf, Junaid",Spatial-temporal nexus of economic complexity interaction with human capital and political stability on environmental quality and their possible causes of change for BRI countries,Journal of Environmental Planning and Management,https://www.tandfonline.com/doi/full/10.1080/09640568.2022.2139226,(2) Environmental Science / Development
Macro Study,General,N/A,2020,"Aung, Thiri Shwesin; Fischer, Thomas B.; Shengji, Luan",Evaluating environmental impact assessment (EIA) in the countries along the belt and road initiatives: System effectiveness and the compatibility with the Chinese EIA,Environmental Impact Assessment Review,https://linkinghub.elsevier.com/retrieve/pii/S0195925519302112,(2) Environmental Science / Development
Macro Study,General,N/A,2018,"Bai, Ruhai; Wei, Junxiang; An, Ruopeng; Li, Yan; Collett, Laura; Dang, Shaonong; Dong, Wanyue; Wang, Duolao; Fang, Zeping; Zhao, Yaling; Wang, Youfa",Trends in Life Expectancy and Its Association with Economic Factors in the Belt and Road Countries—Evidence from 2000–2014,International Journal of Environmental Research and Public Health,http://www.mdpi.com/1660-4601/15/12/2890,Medicine
Macro Study,General,N/A,2020,"Bandiera, Luca; Tsiropoulos, Vasileios",A Framework to Assess Debt Sustainability under the Belt and Road Initiative,Journal of Development Economics,https://linkinghub.elsevier.com/retrieve/pii/S0304387820300705,"(2) Economics, Econometrics and Finance / Development"
Macro Study,General,N/A,2021,"Bashir, Muhammad Farhan; Ma, Benjiang; Qin, Yifang; Bashir, Muhammad Adnan",Evaluation of One Belt One Road publications: a bibliometric and literature review analysis,Environmental Science and Pollution Research,https://link.springer.com/10.1007/s11356-021-14621-y,Environmental Science
Macro Study,General,N/A,2020,"Bastos, Paulo",Exposure Of Belt And Road Economies To China Trade Shocks,Journal of Development Economics,https://linkinghub.elsevier.com/retrieve/pii/S0304387820300493,"(2) Economics, Econometrics and Finance / Development"
Macro Study,General,N/A,2022,"Battamo, Ashenafi Yohannes; Varis, Olli; Giesy, John P.; Oba, Belay Tafa; Aborisade, Moses Akintayo; Sun, Peizhe; Yang, Yongkui; Zhao, Lin","A framework for assessing freshwater vulnerability along China's Belt and Road Initiative: An exposure, sensitivity and adaptive capacity approach",Environmental Science & Policy,https://doi.org/10.1016/j.envsci.2022.03.001,Environmental Science
Macro Study,General,N/A,2021,"Battamo, Ashenafi Yohannes; Varis, Olli; Sun, Peizhe; Yang, Yongkui; Oba, Belay Tafa; Zhao, Lin",Mapping socio-ecological resilience along the seven economic corridors of the Belt and Road Initiative,Journal of Cleaner Production,https://linkinghub.elsevier.com/retrieve/pii/S0959652621015602,Environmental Science
Macro Study,General,N/A,2020,"Bennett, Mia M.",Is a pixel worth 1000 words? Critical remote sensing and China's Belt and Road Initiative,Political Geography,https://linkinghub.elsevier.com/retrieve/pii/S0962629818305043,(2) Development / Sociology and Political Science
Macro Study,General,N/A,2022,"Bennon, Michael; Fukuyama, Francis",The obsolescing bargain crosses the Belt and Road Initiative: renegotiations on BRI projects,Oxford Review of Economic Policy,https://doi.org/10.1093/oxrep/grac002,"Economics, Econometrics and Finance"
Macro Study,General,"Argentina, Bulgaria, Chile, Ecuador, Ethiopia, Kenya, Lesotho, Pakistan, Romania",2022,"Bhandary, Rishikesh Ram; Gallagher, Kelly Sims; Jaffe, Amy Myers; Myslikova, Zdenka; Zhang, Fang; Petrova, Maria; Barrionuevo, Angeles; Fontaine, Guillaume; Fuentes, Jose Luis; Karani, Patrick; Martinez, Daniela; Seitlheko, Likeleli; Staicu, Daniela; Ullah, Najeeb; Yimere, Abay",Demanding development: The political economy of climate finance and overseas investments from China,Energy Research & Social Science,https://linkinghub.elsevier.com/retrieve/pii/S221462962200319X,Social Sciences (Misc.)
Macro Study,General,N/A,2021,"Bian, Jinhu; Li, Ainong; Nan, Xi; Lei, Guangbin; Zhang, Zhengjian",Dataset of the mountain green cover index (SDG15.4.2) over the economic corridors of the Belt and Road Initiative for 2010-2019,Big Earth Data,https://doi.org/10.1080/20964471.2021.1941571,Earth and Planetary Sciences
Macro Study,General,N/A,2021,"Blanchard, Jean-Marc F.",Belt and Road Initiative (BRI) Blues: Powering BRI Research Back on Track to Avoid Choppy Seas,Journal of Chinese Political Science,http://link.springer.com/10.1007/s11366-020-09717-0,Sociology and Political Science
Macro Study,General,N/A,2017,"Blanchard, Jean-Marc F.",Probing China’s Twenty-First-Century Maritime Silk Road Initiative (MSRI): An Examination of MSRI Narratives,Geopolitics,https://www.tandfonline.com/doi/full/10.1080/14650045.2016.1267147,(2) Development / Political Science and International Relations
Macro Study,General,Ethiopia / Tanzania / Egypt / Iraq,2020,"Blanchard, Jean-Marc F.",Problematic Prognostications about China’s Maritime Silk Road Initiative (MSRI): Lessons from Africa and the Middle East,Journal of Contemporary China,https://www.tandfonline.com/doi/full/10.1080/10670564.2019.1637565,(2) Development / Political Science and International Relations
Macro Study,General,N/A,2017,"Blanchard, Jean-Marc F.; Flint, Colin",The Geopolitics Of China’s Maritime Silk Road Initiative,Geopolitics,https://www.tandfonline.com/doi/full/10.1080/14650045.2017.1291503,(2) Development / Political Science and International Relations
Macro Study,General,N/A,2019,"Brakman, Steven; Frankopan, Peter; Garretsen, Harry; Van Marrewijk, Charles",The New Silk Roads: an introduction to China’s Belt and Road Initiative,"Cambridge Journal of Regions, Economy and Society",https://academic.oup.com/cjres/article/12/1/3/5348484,"(3) Economics, Econometrics and Finance / Development / Sociology and Political Science"
Macro Study,General,N/A,2020,"Buckley, Peter J",China’s belt and road initiative: Changing the rules of globalization,Journal of International Business Studies,http://link.springer.com/10.1057/s41267-019-00283-z,"Economics, Econometrics and Finance"
Macro Study,General,N/A,2020,"Butt, Atif Saleem; Ali, Imran",Understanding the implications of Belt and Road Initiative for sustainable supply chains: an environmental perspective,Benchmarking: An International Journal,https://www.emerald.com/insight/content/doi/10.1108/BIJ-04-2020-0143/full/html,"(2) Business, Management and Accounting / Decision Sciences"
Macro Study,General,N/A,2020,"Cai, Wanlin",Determinants of the renminbi anchor effect: From the perspective of the belt and road initiative,International Journal of Finance & Economics,https://doi.org/10.1002/ijfe.2328,"(2) Business, Management and Accounting / Economics, Econometrics and Finance"
Macro Study,General,N/A,2018,"Cai, Xiang; Che, Xiahui; Zhu, Bangzhu; Zhao, Juan; Xie, Rui",Will developing countries become pollution havens for developed countries? An empirical investigation in the Belt and Road,Journal of Cleaner Production,https://linkinghub.elsevier.com/retrieve/pii/S0959652618319504,Environmental Science
Macro Study,General,N/A,2022,"Cai, Yonglong; Pan, Fenghua",The expansion of Chinese banks along the routes of the Belt and Road Initiative: Following customers and geopolitical relations,Growth and Change,https://doi.org/10.1111/grow.12635,Environmental Science
Macro Study,General,N/A,2020,"Cao, Mingchun; Alon, Ilan",Intellectual Structure of the Belt and Road Initiative Research: A Scientometric Analysis and Suggestions for a Future Research Agenda,Sustainability,https://www.mdpi.com/2071-1050/12/17/6901,Development
Macro Study,General,N/A,2020,"Chai, Danling; Wang, Ming; Liu, Kai",Driving factors of natural disasters in belt and road countries,International Journal of Disaster Risk Reduction,https://linkinghub.elsevier.com/retrieve/pii/S2212420920312760,(2) Earth and Planetary Sciences / Safety Research
Macro Study,General,N/A,2019,"Chan, Emily; Huang, Zhe; Lam, Holly; Wong, Carol; Zou, Qiang",Health Vulnerability Index For Disaster Risk Reduction: Application In Belt And Road Initiative (BRI) Region,International Journal of Environmental Research and Public Health,http://www.mdpi.com/1660-4601/16/3/380,Medicine
Macro Study,General,N/A,2019,"Chan, Hing Kai; Dai, Jing; Wang, Xiaojun; Lacka, Ewelina",Logistics and supply chain innovation in the context of the Belt and Road Initiative (BRI),Transportation Research Part E: Logistics and Transportation Review,https://linkinghub.elsevier.com/retrieve/pii/S1366554519313444,Transportation
Macro Study,General,N/A,2019,"Chan, Jin Hooi; Reiner, David",Evolution in inter-firm governance along the transport biofuel value chain in Maritime Silk Road countries,Transportation Research Part E: Logistics and Transportation Review,https://linkinghub.elsevier.com/retrieve/pii/S1366554518307464,"(2) Business, Management and Accounting / Decision Sciences"
Macro Study,General,N/A,2022,"Che, Bingqing; Jin, Cheng; Lu, Yuqi; Zhu, Chuangeng",Tracking the evolution of cooperative relationship networks among countries located along the Belt and Road: an application of massive cooperation events data,Eurasian Geography and Economics,https://www.tandfonline.com/doi/full/10.1080/15387216.2020.1870514,Development
Macro Study,General,N/A,2018,"Chen, Chih-Cheng; Chen, Chien-Wen; Tung, Yi-Chun",Exploring the Consumer Behavior of Intention to Purchase Green Products in Belt and Road Countries: An Empirical Analysis,Sustainability,http://www.mdpi.com/2071-1050/10/3/854,(2) Environmental Science / Development
Macro Study,General,N/A,2022,"Chen, Fang; Sun, Zhongchang",Big earth data for achieving the sustainable development goals in the belt and road region,Big Earth Data,https://www.tandfonline.com/doi/full/10.1080/20964471.2022.2033424,Earth and Planetary Sciences
Macro Study,General,N/A,2021,"Chen, Fuzhong; Jiang, Guohai; Kitila, Getachew Magnar",Trade Openness and CO2 Emissions: The Heterogeneous and Mediating Effects for the Belt and Road Countries,Sustainability,https://www.mdpi.com/2071-1050/13/4/1958,(2) Environmental Science / Development
Macro Study,General,N/A,2019,"Chen, Hongyi; Jiang, Tianjiao; Lin, Chen; Zhao, Hui",Quantifying Financing Needs in the Belt and Road Countries,Emerging Markets Finance and Trade,https://www.tandfonline.com/doi/full/10.1080/1540496X.2019.1605593,"Economics, Econometrics and Finance"
Macro Study,General,N/A,2021,"Chen, Ji; Cui, Fengming; Balezentis, Tomas; Streimikiene, Dalia; Jin, Huanhuan",What drives international tourism development in the Belt and Road Initiative?,Journal of Destination Marketing & Management,https://linkinghub.elsevier.com/retrieve/pii/S2212571X20301669,"Business, Management and Accounting"
Macro Study,General,N/A,2022,"Chen, Jian; Rojniruttikul, Nuttawut; Kun, Li Yu; Ullah, Sana",Management of Green Economic Infrastructure and Environmental Sustainability in One Belt and Road Enitiative Economies,Environmental Science and Pollution Research,https://link.springer.com/article/10.1007/s11356-021-18054-5,Environmental Science
Macro Study,General,N/A,2019,"Chen, Jin; Bergquist, Robert; Zhou, Xiao-Nong; Xue, Jing-Bo; Qian, Men-Bao",Combating infectious disease epidemics through China’s Belt and Road Initiative,PLOS Neglected Tropical Diseases,https://dx.plos.org/10.1371/journal.pntd.0007107,Medicine
Macro Study,General,N/A,2020,"Chen, Jiyong; Liu, Yishuang; Liu, Wei",Investment facilitation and China's outward foreign direct investment along the belt and road,China Economic Review,https://linkinghub.elsevier.com/retrieve/pii/S1043951X20300559,"Economics, Econometrics and Finance"
Macro Study,General,N/A,2020,"Chen, Maggie Xiaoyang; Lin, Chuanhao","Geographic Connectivity And Cross-Border Investment: The Belts, Roads And Skies",Journal of Development Economics,https://linkinghub.elsevier.com/retrieve/pii/S0304387820300444,"(2) Economics, Econometrics and Finance / Development"
Macro Study,General,N/A,2019,"Chen, Mingxing; Sui, Yuwen; Liu, Weidong; Liu, Hui; Huang, Yaohuan",Urbanization patterns and poverty reduction: A new perspective to explore the countries along the Belt and Road,Habitat International,https://linkinghub.elsevier.com/retrieve/pii/S019739751830852X,(2) Environmental Science / Urban Studies
Macro Study,General,N/A,2019,"Chen, Qiao; Cheng, Jianquan; Wu, Zhiqin",Evolution of the Cultural Trade Network in “the Belt and Road” Region: Implication for Global Cultural Sustainability,Sustainability,https://www.mdpi.com/2071-1050/11/10/2744,Development
Macro Study,General,N/A,2019,"Chen, Shi; Lu, Xi; Miao, Yufei; Deng, Yu; Nielsen, Chris P.; Elbot, Noah; Wang, Yuanchen; Logan, Kathryn G.; McElroy, Michael B.; Hao, Jiming",The Potential of Photovoltaics to Power the Belt and Road Initiative,Joule,https://linkinghub.elsevier.com/retrieve/pii/S2542435119302752,Energy
Macro Study,General,N/A,2022,"Chen, Wei; Zhang, Haipeng",Characterizing the Structural Evolution of Cereal Trade Networks in the Belt and Road Regions: A Network Analysis Approach,Foods,https://doi.org/10.3390/foods11101468,Agricultural and Biological Sciences
Macro Study,General,N/A,2020,"Chen, Xianpeng; Liu, Qingyan; Fang, Kai; He, Jianjian; Chen, Yang; Wang, Tingting; Fang, Chuanglin; Shen, Yang",Tracking National Sustainability Of Critical Natural Capital And The Socioeconomic Drivers In The Context Of The Belt And Road Initiative,Ecological Indicators,https://linkinghub.elsevier.com/retrieve/pii/S1470160X20302521,Environmental Science
Macro Study,General,N/A,2020,"Chen, Ya; Liu, Shenbao; Wu, Huaqing; Zhang, Xiaoling; Zhou, Qian",How can Belt and Road countries contribute to glocal low-carbon development?,Journal of Cleaner Production,https://linkinghub.elsevier.com/retrieve/pii/S0959652620307642,Environmental Science
Macro Study,General,N/A,2021,"Chen, Yang; Chao, Yiying; Liu, Wei; Tao, Kan; Lian, Peng","Make friends, not money: How Chinese enterprises select transport infrastructure investment locations along the Belt and Road",Transport Policy,https://linkinghub.elsevier.com/retrieve/pii/S0967070X20309422,(2) Development / Transportation
Macro Study,General,N/A,2019,"Chen, Yaowen; Fan, Zuojun; Zhang, Jie; Mo, Min",Does the Connectivity of the Belt and Road Initiative Contribute to the Economic Growth of the Belt and Road Countries?,Emerging Markets Finance and Trade,https://www.tandfonline.com/doi/full/10.1080/1540496X.2019.1643315,"Economics, Econometrics and Finance"
Macro Study,General,N/A,2022,"Chen, Zanxu; Yang, Yongjun; Zhou, Lai; Hou, Huping; Zhang, Yanzhu; Liang, Jie; Zhang, Shaoliang",Ecological restoration in mining areas in the context of the Belt and Road initiative: Capability and challenges,Environmental Impact Assessment Review,https://doi.org/10.1016/j.eiar.2022.106767,Environmental Science
Macro Study,General,N/A,2020,"Chen, Zhenling; Wang, Wenju; Li, Feng; Zhao, Weigang",Congestion assessment for the Belt and Road countries considering carbon emission reduction,Journal of Cleaner Production,https://linkinghub.elsevier.com/retrieve/pii/S0959652619332755,Environmental Science
Macro Study,General,N/A,2021,"Chen, Zhenling; Yan, Tian; Zhao, Weigang; Ni, Guohua",Capacity utilization loss of the Belt and Road countries incorporating carbon emission reduction and the impacts of China’s OFDI,Journal of Cleaner Production,https://linkinghub.elsevier.com/retrieve/pii/S0959652620339718,Environmental Science
Macro Study,General,N/A,2022,"Chen, Zhihua; Wang, Hui",Research on the impact of the Belt and Road Initiative on the sustainability of the resource-based economy of participating countries,Environmental Science and Pollution Research,https://link.springer.com/10.1007/s11356-022-22141-6,Environmental Science
Macro Study,General,N/A,2016,"Cheng, Leonard K.",Three questions on China's “Belt and Road Initiative”,China Economic Review,https://linkinghub.elsevier.com/retrieve/pii/S1043951X16300797,"Economics, Econometrics and Finance"
Macro Study,General,N/A,2021,"Cheng, Si; Qi, Shaozhou",The potential for China's outward foreign direct investment and its determinants: A comparative study of carbon-intensive and non-carbon-intensive sectors along the Belt and Road,Journal of Environmental Management,https://linkinghub.elsevier.com/retrieve/pii/S0301479721000220,Environmental Science
Macro Study,General,Cambodia / Belarus / Ethiopia,2020,"Cheng, Zhangxi",Building the belt and road initiative? – practices en route,The Pacific Review,https://www.tandfonline.com/doi/full/10.1080/09512748.2019.1589560,(2) Development / Sociology and Political Science
Macro Study,General,N/A,2018,"Chhetri, Prem; Nkhoma, Mathews; Peszynski, Konrad; Chhetri, Anjali; Lee, Paul Tae-Woo",Global Logistics City Concept: A Cluster-Led Strategy Under The Belt And Road Initiative,Maritime Policy & Management,https://www.tandfonline.com/doi/full/10.1080/03088839.2017.1400700,Transportation
Macro Study,General,N/A,2022,"Chin, Mui-Yin; Ong, Sheue-Li; Ooi, Daniel Boon-Yann; Puah, Chin-Hong",The impact of green finance on environmental degradation in BRI region,"Environment, Development and Sustainability",https://link.springer.com/10.1007/s10668-022-02709-5,(2) Environmental Science / Development
Macro Study,General,N/A,2018,"Choi, Hyung Rim; Moon, Young Sik; Kim, Jae Joong; Lee, Jae Kee; Lee, Kang Bae; Shin, Joong Jo",Development of an IoT-based container tracking system for China’s Belt and Road (B&R) initiative,Maritime Policy & Management,https://www.tandfonline.com/doi/full/10.1080/03088839.2017.1400190,Transportation
Macro Study,General,N/A,2019,"Chong, Zhaohui; Qin, Chenglin; Pan, Su",The Evolution of the Belt and Road Trade Network and Its Determinant Factors,Emerging Markets Finance and Trade,https://www.tandfonline.com/doi/full/10.1080/1540496X.2018.1513836,"Economics, Econometrics and Finance"
